tools_names,urls,what_is,pricing,tags,use_cases
Bodify.Io,https://topai.tools/t/bodify-io,"Bodify is an AI tool that uses predictive analytics to help online retailers improve return rates, increase average cart value (ACV), boost shopper loyalty, and gain improved insights. The tool partners with retailers to enable more customized and effective product recommendations, resulting in better shopper experiences and increased revenue. Retailers interested in joining Bodify can contact them for more information.",Visit Site,E-commerce,"Optimize return rates and increase ACV for e-commerce retailers.
Boost shopper loyalty on your website and brand.
Gain improved insights about your retail business."
LalaLand.Ai,https://topai.tools/t/lalaland-ai,"Lalaland.ai is an AI-powered digital model studio that allows digital designers to create and customize unique avatars and lifelike models to enrich product designs.The software enables designers to create unique avatars in less than 5 minutes, customize every individual avatar including hair style, body shape, size, and skin color, and select from a range of poses, emotions, and features to enhance the overall image.

Additionally, designers can bring 3D designs to life by adding clothing to their avatar, creating a lifelike model to validate garments early in the process.Lalaland.ai helps to uplift wholesales and shorten time to market while enjoying a streamlined and sustainable process that eliminates the need for physical samples and photoshoots.",Free trial,Fashion,"Create unique avatars for your products quickly and easily.
Customize every individual avatar to showcase your designs.
Bring 3D designs to life by adding clothing and accessories."
Toolsit.Ai,https://topai.tools/t/toolsit-ai,"ToolsIT is an AI-powered tool that offers a wide range of features for efficient and engaging copywriting. It provides templates and prompts for various types of content, including blog posts, emails, social media posts, and website content.

Users can generate personalized copy for sales outreach and improve the quality of their output by working with prebuilt prompts. The tool also allows users to scrape websites for public data, summarize YouTube videos, and generate code. With ToolsIT's editor, users can easily edit, rewrite, and polish their content before publishing it.",Free trial,Content Creation,"Create content at scale for blog articles, social media posts or Ad copy..
Data scraping for content creation from various sources.
Make video summaries for key points and repurpose for content creation."
Simplified Image Captions,https://topai.tools/t/simplified-image-captions,"The AI tool is a photo caption generator. It allows users to quickly and easily generate captions for their photos. The tool also offers other features such as an AI writer for creating content for blogs, social media, and websites, a video editor and animation tool for creating and collaborating on videos for platforms like TikTok, Instagram, and YouTube, and social media management capabilities for growing a business through seamless social media management.

Other key features of the tool include an AI presentation maker, an AI image generator, an AI background remover, a magic resizer, an animation maker, an AI content rewriter, an AI blog writer, and the ability to create posts and stories for platforms like Instagram, Facebook, LinkedIn, and Pinterest.

The tool also offers various templates for designs, videos, and social media content, as well as resources such as a blog and video academy.",Freemium,Images,"Generate captions for photos for social media posts.
create content for blogs and social media by captioning images.
Edit and animate videos for platforms like TikTok, Instagram, and YouTube."
Instant Potrait,https://topai.tools/t/instant-potrait,"Instant Portrait is an AI-powered app that generates unlimited unique personalized portrait avatars for free. It is designed for both iPad and iPhone and is easy to use. The app generates highly realistic depictions quickly, making it an excellent tool for users who require quick and easy avatar creation.",Free,Avatar,"Quick and easy avatar creation on mobile phone.
Personalized avatar generation on phone or tablet."
EmoGPT,https://topai.tools/t/emogpt,"Emogpt is a free AI-powered Google Chrome extension designed for Gmail users to generate high-quality emails with ease and efficiency. The tool is powered by OpenAI's chatGPT, ensuring data privacy and security. Emogpt provides a secure and user-friendly interface that prioritizes privacy and stores settings locally on the browser. Users can install the extension from the Chrome web store and choose whether to use a chatGPT account API key.

Emogpt features a smiling emoji button that appears in the toolbar of the email window, allowing users to quickly generate new emails based on their personalized preferences. The tool leverages the power of AI to automate email writing, from replies to follow-ups and even cold outreach emails, reducing the time users spend writing emails by up to 85%. While the tool is free, the team may consider adding advanced features that require additional resources for team collaboration in the future.",Free,Email,"Automated email writing and replies using a tone ands style.
Save time on email replies by having the tool write the replies for you based on context and style.
Automating and personalizing cold outreach emails."
Stonks GPT,https://topai.tools/t/stonks-gpt,"Stonks News allows users to search for news related to top 100 stocks, insider transactions, and popular stocks on Reddit. Users can also view charts for stocks such as Apple, Google, and Amazon over the last 30 days, as well as Uber, Lyft and DoorDash over the last 3 months. The tool offers a heatmap and insider news for investors to make informed decisions. Stonks News has a user-friendly interface and provides an easy way to keep track of your stock market investments.",Free,Finance,"Track top 100 stocks for your investment portfolio.
Monitor insider transactions by asking questions in natural language.
Analyze popular stocks on Reddit."
AI Brain Bank,https://topai.tools/t/ai-brain-bank,"AI Brain Bank is a tool that uses AI to learn and query documents, media and knowledge. Its main features include the ability to retrieve accurate and relevant information quickly and easily from your documents and PDF files, and its suitability for use in areas such as customer support, business development and inquiries. The tool is designed to be easy to use and to provide fast and accurate results, making it ideal for anyone who needs to quickly search and find information.",Freemium,Productivity,"Learning faster by querying your documents and media files for information.
Team support for searching through knowledge bases and documents.
Chat with your documents and media files and get answers."
Blackbox Direct,https://topai.tools/t/blackbox-direct,"Copydesk is an AI-enabled platform that automates content generation and publication for WordPress sites.It uses AI to analyze articles and press releases from diverse sources, extract relevant information, and rewrite them accurately and coherently.

The platform seamlessly integrates with WordPress sites, making publishing hassle-free with just one click.Copydesk provides tailor-made articles that fit a brand's tone, style, and voice, making it suitable for personal blogs, media organizations, and corporate websites.",Free trial,Content Creation,"Automated article rewriting after researching different sources and press releases.
Tailor-made content generation for your wordpress blog.
Hassle-free publishing of written content to your wordpress blog."
TalkBerry,https://topai.tools/t/talkberry,"Talkberry is an AI tool that provides a safe environment to practice English and job interview skills by simulating a job interview with the help of an AI hiring manager. The tool offers instant feedback and personalized suggestions, powered by ChatGPT, to improve spoken English and hone interview skills.

It also provides valuable insights into strengths and weaknesses, ensuring readiness for success. The tool is accessible anytime, anywhere and enhances experience with voice-based conversation and professional mock interviews. The tool is suitable for individuals seeking to boost their confidence and ace job interviews.",Free trial,Job Search,"Interview simulator to practice English interview language.
Business English speaking practice tool for your next interview.
English practice, Job interview AI assistant."
KittensAI,https://topai.tools/t/kittensai,The AI tool generates kitten images with various scenes and settings. It is available in multiple languages and offers an API.,Usage based,Image generation,"Cat lovers can create as many cat images as needed.
Making stories, albums or videos about cats or kittens."
Smartersales,https://topai.tools/t/smartersales,"Smartersales focuses on streamlining sales call data management through automation. It integrates with platforms like Zoom, Teams, and Meet to pull call recordings for in-depth examination and automates CRM data entry. The tool provides instant, personalized feedback and evaluates key performance areas for continual improvement.

Managers can access detailed performance dashboards and summarized email reports for each call. The experience is completely customizable to set CRM data preferences and extract specific data needed for each call. The tool also provides learning materials and stunning charts to better understand sales data and improve sales performance metrics.",Free,Sales,"Automated CRM data entry automation to streamline your sales process.
Sales Performance evaluation and improvement from sales calls analysis.
Customizable data extraction from sales calls and meetings as needed."
Summer AI,https://topai.tools/t/summer-ai,"Summer AI is an AI-powered tour guide app available on the Apple Store for iPhones and iPads. The app uses AI GPS technology to access millions of points of interest globally to provide users with a personalized experience while exploring new neighborhoods or embarking on road trips. It offers walking and driving navigation, augmented reality discoveries, and visually enhanced journey through the AR-enabled feature.

Users can also discover upcoming local events in the area through the app. Summer Aiâ€™s database of points of interest around the world is curated by human experts, and the app allows users to delve into detailed content using its immersive experience feature. The app is available for free with in-app purchases for monthly and yearly unlocks.",Free,Travel,"Explore new neighborhoods while on travel using your phone's GPS technology.
Embark on amazing road trips and discover new places.
Discover upcoming local events easily."
Tripplanner.Ai,https://topai.tools/t/tripplanner-ai,"Trip Planner AI helps you plan your next trip.Trip planner AI will suggest potential destinations based on your interests and budget.Users can also input their preferences for accommodation, activities, and transportation to receive personalized itineraries.

The tool can also suggest nearby restaurants and attractions.Overall Trip Planner AI is useful for travelers who are unsure of where to go and what to do on their trip.It can save time and provide a convenient way to plan a trip without having to research destinations and activities for hours.",Freemium,Travel,"Generate personalized itineraries based on interests and budgets.
Suggest nearby attractions and restaurants on your travel.
Save time researching destinations for your next trip."
IPlan.Ai,https://topai.tools/t/iplan-ai,"Iplan.ai is a smart travel planning app that uses artificial intelligence to create personalized itineraries based on user preferences, trip purpose, interests, budget, and length of stay. It allows users to access their itineraries anywhere and make changes as needed. The app has a free pricing model and offers features such as saving time, creating a smart itinerary, and receiving updates via email. It has received positive user feedback and offers articles on popular destinations to aid travel planning.",Free,Travel,"Save time on travel planning with an AI trip planner.
Create a smart itinerary quickly and discover places to visit and see.
Access and modify your AI generated itinerary from anywhere on the go."
Plantrips.Net,https://topai.tools/t/plantrips-net,"Plantrips is an AI travel planner tool that generates custom travel itineraries within 2 minutes, saving hours of trip planning. It helps users plan trips based on budget and duration for destinations like Paris, Rome, Moscow, Berlin, and more. The tool allows users to create personalized itineraries that include activities like sports, swimming, SUP, exploration, and food.

It also provides recommendations for travel, including tips for saving money on accommodation, food, and transportation.

Plantrips has a community feature where users can browse through the latest itineraries created by other users. The tool is available in English and Vietnamese and is free to use.",Free,Travel,
Zmo Anime Generator,https://topai.tools/t/zmo-anime-generator,"The AI anime generator is an easy-to-use tool that allows users to create stunning anime characters and images using simple prompts or by converting text to anime. The tool offers precision control and unparalleled detail, making it perfect for artists and designers looking to unleash their creativity. Users can also upload photographs and select a style to transform their photos into stunning AI-generated images. The tool also features facial enhancement capabilities that enable users to analyze and enhance facial features for lifelike and natural-looking images. The AI anime generator is free to use, but some features require credits that can be earned by sharing or creating an account. The AI anime generator was built by the zmo.ai team behind imgcreator.ai, a company that also offers other AI-powered image creation tools such as the text-to-image generator and image-to-image AI.",Freemium,Art Generation,"Create anime characters and images.
Transform photos into AI-generated anime images.
Create anime art for stories and videos."
SmartGPT,https://topai.tools/t/smartgpt,"SmartGPT is an AI tool that outperforms GPT-4 with enhanced prompts and responses generated without advanced prompt engineering. It uses advanced prompt engineering techniques modeled after experts to generate these enhanced prompts and responses. SmartGPT Plus+ offers unlimited access to enhanced expert prompts and responses, along with a business prompt starter pack, a marketing strategy prompt generator, and a prompt analysis tool.

The tool aims to optimize prompts for businesses and save them time and effort in research. The SmartGPT community has access to free business prompts and top AI industry news.",Subscription,Prompt Guides,"Optimizing business prompts to get better results out of GPT models.
Marketing or business strategy enhanced prompt generation.
Improve your existing prompts and to get better results."
Textreactai,https://topai.tools/t/textreactai,"TextReactAI is an AI-powered content improver tool that uses AI technology to create content for blogs, articles, websites, and social media in more than 25 languages. TextReactAI offers AI templates for generating catchy blog titles, blog sections, intros, and engaging conclusions. It also includes a paragraph generator, a content rewriter, and a summary tool that can convert complex content into short, easy-to-understand summaries.

It also includes advanced features like content optimization, sentiment analysis, and language translation to enhance content creation efforts. TextReactAI sets itself apart from other AI content writing solutions by providing ease of use, cost-effectiveness, and support from a team of experts. The tool supports 33 languages, including English, Spanish, French, Japanese, and Persian.",Freemium,Content creation,"Generate catchy blog titles and intros for blog posts and articles.
Rewrite existing content to improve rankings or keep it updated.
Create easy-to-understand summaries from existing content."
CourseAI,https://topai.tools/t/courseai,"CourseAI is a cutting-edge platform that lowers the barriers to entry in creating and selling online courses. It leverages the power of AI to reduce the skills gap needed to create high-quality content and market online courses. It uses artificial intelligence to streamline the online course creation and launch process.

The platform is user-friendly and intuitive, so that any person without any technical expertise or knowledge is able to do it with ease. Its ability to curate content to match the needs of a specific target audience and customer persona is just one of the features thatâ€™s unique to CourseAI. The platform also generates ready-to-use video scripts and voice overs that can enhance the online course experience for potential students of a course.",Freemium,Education,"Simplifying online course creation for non-technical users.
Automating course generation and customization.
Enhancing course experience with AI-generated scripts and voice overs."
FoodZilla.Io,https://topai.tools/t/foodzilla-io,"Foodzilla is a meal planning and nutrition coaching software designed for professionals. It offers a wide range of features to streamline the process of creating meal plans, managing recipes, and tracking clients' progress. The software includes a recipe builder with access to over 100,000 recipes with nutrition labels, allowing users to easily create customized meal plans based on their clients' needs.

It also provides a fast and flexible meal planning system, a mobile app for clients to follow meal plans and track their progress, secure messaging for easy communication, nutrition reports to monitor clients' nutrition and health goals, and automated grocery lists.

Additionally, Foodzilla offers customization options, allowing professionals to personalize the app experience for their clients. With its comprehensive features and user-friendly interface, Foodzilla simplifies meal planning and nutrition coaching, making it an essential tool for professionals in the field.",Free trial,Health,"Creating personalized meal plans for clients.
Tracking clients' nutrition and health goals.
Streamlining communication and progress tracking with nutrition coaching clients."
LessEffort.Io,https://topai.tools/t/lesseffort-io,"Lesseffort Chat App enhances your AI assistant experience with a beautiful UI powered by GPT. Customize the app's appearance to match your personal preference and create prompts for accurate and relevant responses.

Easily share conversations, collaborate, and seek feedback with shareable links. Save important messages for valuable insights and personalize the AI assistant's tone and language style.

Stay informed about openAI API usage and much more. Elevate your AI assistant experience and streamline GPT interactions with Lesseffort AI's user-friendly features.",Freemium,Chat,
Avian,https://topai.tools/t/avian-io-plugin,"The Avian ChatGPT Plugin is a powerful tool that allows users to access and interact with their business data from various sources such as Google Analytics, Facebook Ads, and Google Ads. With the ability to ask questions and receive instant answers, users can analyze their data, combine data from multiple sources, and gain valuable insights using natural language queries.

The plugin offers unlimited possibilities for data analysis, including real-time performance data, historical data exploration, and the ability to dive deep into custom metrics and conversions. With secure data handling and a user-friendly setup process, the Avian ChatGPT Plugin provides a seamless and efficient way to leverage data for informed decision-making and business growth.",Free trial,Business,"Real-time performance tracking of different business sources.
Data and campaign analytics exploration within chatGPT.
Connect your business data sources to ChatGPT and interact with them in natural language."
Prompt Refine,https://topai.tools/t/prompt-refine,"Prompt Refine is an AI tool that helps users build prompts in a structured way by adding variables, editing parameters and creating new folders for prompts. It allows users to refine prompts quickly by hitting the ""add variable"" key and submit+enter prompt. Prompt Refine also includes a history clear feature to see recent prompts and responses. The tool is designed for better prompt experiments and allows users to track performance, create prompt variants, and organize history. It is compatible with OpenAI models, anthropic models, together models, cohere models and local model. Prompt Refine allows users to export runs in CSV format for analysis and comparison.",Free,Prompt Guides,"Create structured prompts to get better results of AI tools.
Track prompt performance by creating prompt variants and testing them across models.
Get prompt ideas and share enhanced prompts with your team."
AI Lesson Plan,https://topai.tools/t/ai-lesson-plan,"AI Lesson Plan is a cloud-based generative AI platform that helps educators create custom, age-specific, and engaging lesson plans tailored to their class in a fraction of the time.The platform offers multiple lesson plan formats, including common ones such as 5E, Madeline Hunter, and Bloom's Taxonomy, and users can also customize their lesson plan templates.

AI Lesson Plan provides one-click creation of accompanying resources like rubrics, worksheets, homework assignments, and assessments. Pricing models include a free trial, basic plan, and enterprise plan, with discounts for yearly payments. The platform is fully customizable to meet personal educational standards and tailored to specific class subjects, grade-levels, and textbooks, creating a perfect teacher's aid software that saves teachers hours of work.",Free trial,Education,"Create custom lesson plans with a specific teaching style.
Generate accompanying resources for teaching a subject.
Customize lesson plan templates for a subject."
Problembo Anime Generator,https://topai.tools/t/problembo-anime-generator,"The anime image maker is an AI tool that generates unique anime-style images and avatars using prompts. It allows users to create high-resolution artwork of anime characters in various styles, such as full-body, bikini, robotic, and manga. The tool offers negative prompts to remove certain elements from the generated image.

The tool allows users to upload an image or use a text prompt to generate an image, and the initial image can be used in conjunction with the text prompt. Users can also experiment with settings using seed values to create playable images or refine the generated images. The anime style is characterized by features such as large expressive eyes, exaggerated features, vibrant colors, simplified shapes, and emotive expressions.

The anime style has become increasingly popular worldwide, and the tool is suitable for anime enthusiasts, illustrators, or content creators looking for unique anime-style images.",Visit Site,Art Generation,
Live3d Anime Generator,https://topai.tools/t/live3d-anime-generator,"Live3D offers a free anime AI art generator that allows users to create unique anime art without needing painting skills. The tool enables anyone to enter prompts for the anime art they want to generate and creates unique and stunning anime pictures that perfectly match the prompts.

Additionally, the AI anime art generator also allows users to create AI VTuber avatars by choosing the best AI avatars with several simple steps. Live3D's AI anime art generator integrates stable and efficient training models that provide a variety of anime art styles, such as realistic anime art style, oil painting art style, and black and white manga style.

The tool is a convenient tool for generating anime-inspired artwork, aiding creative projects, and offering inspiration, reference material, and a starting point for customization.",Freemium,Art Generation,"Create unique anime art without painting skills.
Generate AI VTuber anime avatars.
Create anime art for personal projects, movies or stories."
Anime Diffusion,https://topai.tools/t/anime-diffusion,"Getimg.ai is an online image-generation tool that allows users to create anime-style images and characters with just a few simple prompts. It offers a fully integrated suite of image-generation tools with over 20 AI models and custom community styles. Users can generate up to 100 images free every month and can use the generated images commercially. The tool is suitable for art creation, photo editing, and design inspiration, and can be used for a wide range of use cases. The product is free to use, and users can earn credits by referring friends and followers.",Freemium,Image generation,"Create anime-style images.
Design AI characters anime photos.
Generate anime art using AI."
CPUmade,https://topai.tools/t/cpumade,"CPUmade allows users to create unique t-shirt designs with the help of AI. Users can describe the design they want to create and the AI model will get to work to help them customize it. Users can then change the color of the t-shirt and pick the size before adding it to their cart. The tool also allows users to browse a community of designs for inspiration, follow their favorite makers, and keep up-to-date with the latest designs.",Usage based,Fashion,"Create custom t-shirt designs with AI assistance.
Browse community AI T-Shirt designs for inspiration.
Make money by creating and selling your own T-shirt designs."
