tools_names,urls,what_is,pricing,tags,use_cases
Mailscribe,https://topai.tools/t/mailscribe-com,"Mailscribe is a next-generation email marketing platform, powered by artificial intelligence, which facilitates the speedy creation and dispatch of emails to your subscriber base using integrated components. With Mailscribe, time spent on email design is significantly reduced thanks to its multitude of design elements. Plus, the platform contains AI tools that enable the rapid creation of email content, leveraging the strength of artificial intelligence.

Mailscribe provides advanced email marketing tools that optimizes content, subject lines, and send times for maximum impact, reducing manual efforts. It offers a user-friendly drag-and-drop interface with pre-designed components for creating professional emails quickly. The platform also provides extensive customization options, allowing users to personalize their emails and maintain brand consistency.

Mailscribe leverages AI algorithms to analyze user engagement data and optimize email campaigns for better results. Additionally, it offers time-saving automation features, a component store with various pre-built elements, and performance-driven newsletter features, making it a comprehensive solution for achieving email marketing success.

The platform also includes subscriber management, email statistics, and collaboration features, catering to bloggers, business owners, and content creators to enhance their newsletter performance.",Freemium,Email,"Automate and optimize email campaigns.
Create professional-looking emails without design experience through an intuitive interface.
Personalize emails and maintain brand consistency easily."
AI Baby Generator,https://topai.tools/t/aibabygenerator-com,"AI Baby Generator is a personalized baby face generator powered by artificial intelligence.Predict what your baby will look like using the latest A.I.and facial matching technology! Highly accurate baby face generator, just upload your photo.

Have you ever thought - what will my baby look like? Wonder no more because AI Baby Generator will construct hyper-realistic photos of your future child based on pictures of you and your partner.Aibabygenerator.

com allows you to upload photos of just yourself, with your partner, or with a celebrity crush so you can see all possibilities of your future baby using AI.It can even generate accurate baby photos based on your physical description, so photo uploads are not mandatory.

See Your Future Baby in Multiple Settings - Unlike some AI image generators that only offer one static image, AI Baby Generator can create photos of your AI baby in different settings - wearing different clothes, varied expressions, and in front of different backgrounds!

Fast Baby Photo Delivery - All orders are delivered within 24 hours.

After generating your future child, the team at AI Baby Generator will manually review and enhance each photo for optimal facial matching and quality.Data Privacy & Refund Policy - All orders come with a 3-day money-back refund policy.

If youâ€™re not satisfied with what would your child look like according to AI Baby Generator, you can request to refund the purchase and still keep the photos.Any information you provide will be kept private and secure, and only be used to create your order.",Usage based,Image Generation,"Generate hyper-realistic baby photos based on uploaded photos of parents.
See what your future baby would look like based on a photo of your celebrity or a crush.
Receive a 7-page detailed report on future baby's zodiac sign, love language, and personality traits."
CometCore AI,https://topai.tools/t/cometcore-ai,"Cometcore AI is an innovative platform that offers a versatile range of AI-powered tools to enhance productivity and communication. With Cometcore, you can craft, code, and automate adorable agents to assist you in various digital tasks.

The main features of Cometcore include freestyle coding AI assistance, code generation templates, and collaborative development features. It also provides multimedia editing and enhancement tools, allowing you to effortlessly edit and enhance videos, sound, and images using AI-driven technology.

With Cometcore's automation capabilities, you can sit back and observe as two robot agents collaborate to accomplish a list of tasks. It also offers advanced AI-powered writing templates for generating compelling text, blog tools for content creation, and marketing tools for creating ad copy and designing banners to target the right audience on top ad platforms.

Additionally, Cometcore provides SEO and data analysis tools for creating SEO-friendly content, performing keyword research, and analyzing data through AI-powered visualization and reporting. It also offers website building capabilities for creating professional landing pages with just a click.

Cometcore's online GPT automation allows you to discover the potential of GPT-4 automation through a connected platform. It enables you to effortlessly create custom AI agents that streamline daily tasks and perform common actions through user-friendly commands. You can even personalize your AI assistant to reserve tables, order groceries, and maximize productivity, simplifying your life.

Cometcore supports both chat and voice interactions, allowing you to interact with GPT-4 through text commands or voice recordings in your preferred language. This user-friendly platform breaks language barriers and provides seamless access to powerful AI capabilities.",Freemium,Automation,"Crafting, coding, and automating adorable AI agents to perform the tasks of your choice.
Automated dditing and enhancing multimedia using AI-driven technology based on any workflow.
Creating SEO-friendly content and performing data analysis with an automation agent."
Doodle Morph AI,https://topai.tools/t/doodle-morph-ai,"Doodle Morph AI is an innovative AI-powered tool that revolutionizes the transformation of doodles into stunning photo-realistic art. With this amazing app, you can turn your simple drawings into captivating artwork that looks like it was created by a professional artist.

Whether you want to add a unique touch to your designs or create eye-catching illustrations, Doodle Morph AI is the perfect solution. It utilizes advanced AI algorithms to generate realistic textures, shadows, and details, giving your artwork a lifelike appearance.

This app is not just for artists - it is also a valuable tool for app designers and businesses looking to enhance their branding and visual content. By utilizing the powerful art generation capabilities of Doodle Morph AI, you can create stunning home screen shots, design professional-looking app interfaces, and develop captivating marketing materials.

Take a look at the screenshots to see the impressive results that Doodle Morph AI can achieve. From simple sketches to intricate drawings, this art generator app has the ability to transform them all.",Visit Site,Art Generation,"Enhancing designs and illustrations.
Creating captivating marketing materials.
Developing professional app interfaces easily from doodles."
Samwell,https://topai.tools/t/samwell,"Samwell is an AI-powered tool designed to assist with various writing tasks. With its user-friendly interface and advanced features, Samwell makes writing essays and resumes an effortless process. It offers a range of helpful functions and does not overwhelm users with unnecessary marketing jargon.

One of Samwell's notable features is its Essay Writer. This tool allows you to generate smart and plagiarism-free essays by providing valuable insights and suggestions. Additionally, it generates a comprehensive essay report for a complete overview of your work.

Samwell also comes with a Cover Letter Generator, which assists in creating personalized, professional, and targeted cover letters. This feature streamlines the process of crafting impactful cover letters, helping you make a positive impression on potential employers.

Furthermore, Samwell has the ability to analyze audio and text, making it an essential tool for summarizing complex information. It can even generate infographics to visually represent key points.

Lastly, Samwell ensures data privacy and security through its well-defined terms of service and privacy policy. It also enables users to upgrade their accounts for additional features and word limits.",Freemium,Writing,"Generating smart and plagiarism-free essays with valuable insights.
Crafting personalized and professional cover letters for job applications.
Analyzing audio/text and creating infographics for summarizing complex information."
Revocalize AI,https://topai.tools/t/revocalize-ai,"Revocalize AI is an innovative tool that allows users to create, clone, and protect unique voices using AI technology. This tool is like Photoshop, but for voices, allowing you to manipulate and transform vocal recordings with ease. With Revocalize AI, you can explore a wide range of voice models, from male and female curbing voices to rock legends, pop sensations, country stars, and even opera maestros.

This tool is ideal for sound engineers and producers looking to enhance vocal performances, as it offers features such as voice beautification, synthesizing, modulation, and an extensive catalog of voices from different corners of the world. Revocalize AI gives you the ultimate range of emotions and language versatility, allowing your voice to achieve exceptional expressiveness and cross language barriers.

Whether you're a music enthusiast or an artist looking to elevate the quality of your productions, Revocalize AI offers a secure collaborative platform for seamless communication with music lovers around the world. With its VST plugin, creators, artists, and producers can easily perform voice transformations, beautification, and harmonizing, taking their music production to the next level.",Freemium,Audio editing,"Enhancing vocal performances.
Voice transformation and beautification.
Collaborative music production."
BetterLegal Assistant,https://topai.tools/t/betterlegal-assistant,"BetterLegal Assistant is a Chrome extension tool that aims to simplify legal language for everyone. This innovative tool allows users to transform complicated legalese into straightforward language within seconds. With BetterLegal Assistant's free extension, users can easily copy legal text and paste it into the tool, then click ""explain"" to receive a clear and concise translation.

The tool empowers users to navigate the world of legal language with ease. It converts complex legal jargon into clear and easy-to-understand terms that even a anyone can grasp. Whether you are reviewing contracts, agreements, or official documents, BetterLegal Assistant breaks down the barriers of legalese, ensuring that you are always informed and never left in the dark.",Free,Legal,"Reviewing contracts and agreements.
Understanding legal documents.
Translating legal jargon to simple language."
ComfyUI,https://topai.tools/t/comfyui,GitHub - comfyanonymous/ComfyUI: A powerful and modular stable diffusion GUI with a graph/nodes interface.This ui will let you design and execute advanced stable diffusion pipelines using a graph/nodes/flowchart based interface. For some workflow examples and see what ComfyUI can do you can check out the github repo for the tool.,Free,Developer tools,"Create stable diffusion workflows.
Automate art creations with stable diffusion."
Regex.Ai,https://topai.tools/t/regex-ai,"Regex.ai is an artificial intelligence (AI) tool designed to generate regular expressions. With regex.ai, you can simplify the process of creating regular expressions by using its AI-powered regular expression solver. The tool allows you to insert text and then drag your cursor to highlight multiple strings that you want the regular expression to match.

One of the main features of regex.ai is the ability to click on the highlighted text to remove it. This makes it easy to fine-tune your regular expression and ensure that it matches exactly what you need.

In addition to its intuitive user interface, regex.ai provides helpful documentation to guide you through the process of using the tool effectively.

Some common use cases for regex.ai include data extraction, text analysis, and search pattern matching. Whether you are a developer, data scientist, or analyst, regex.ai can aid in your workflow by automating the regular expression generation process.",Visit Site,Developer tools,"data extraction.
text analysis.
search pattern matching."
PhotoEditor.Ai,https://topai.tools/t/photoeditor-ai,"AI Photo Editor provides a set of photo editing tools that can seamlessly remove unwanted objects, people, or text from images, it allows you to keep only what matters most in your photos. It can effortlessly enhance image quality, making your photos clearer and more vivid than ever before. Fix image imperfections, transform your photos into sharp, high-quality pictures. The AI Photo Editor is a versatile and user-friendly tool, built to elevate photo editing experience and help to create stunning photos without design skills.",Free,Image Editing,"Edit photos quickly for personal and creative projects.
Agencies can use it to double up speed of work.
Real estate and product photos editing for web submission."
NewFuku,https://topai.tools/t/newfuku-com,"Newfuku is an AI tool that allows anyone to easily and quickly change backgrounds in photos. With just a few simple steps, you can revolutionize your photos by seamlessly replacing the background in a matter of seconds. Whether you want to take a selfie on a beach or have a cityscape as the backdrop during a sunset, Newfuku makes it possible.

One of the key features of Newfuku is its user-friendly interface that requires no technical skills. All you need to do is upload your photo, choose the background description you desire, and let the AI do the rest. No complicated editing software or extensive knowledge is necessary.

In addition to changing backgrounds, Newfuku also offers cutting-edge technology to digitally alter attire in images. It's perfect for online retailers, fashion enthusiasts, or anyone looking to have some creative fun. The tool provides high-quality and realistic transformations that respect lighting, perspective, and even body shapes.",Subscription,Image Editing,"Change photo backgrounds.
Change clothes and retouch photos in product photos.
Enhance online retail images."
Omniinfer.Io,https://topai.tools/t/omniinfer-io,"Omniinfer Stable Diffusion API provides developers with powerful AI image generation and AI image creation capabilities that meet various needs such as life image design, image editing, digital media editing, and artistic inspiration. You can use it for your own stable diffusion text2image, image2image ,Support Text to Image, Image to Image, LoRA, ControlNet, Inpainting , free to try it on.

In summary, Omniifer offer three service options to meet your AI image generation needs. With Omniinfer's API service, you can quickly and affordably generate images using over 10,000 models. Omniinfer's WebUI demo service allows you to run models without GPU computation time on websites, with a nominal fee per image.

The WebUI extension service provides a seamless integration with AUTOMAIC1111 UI and enables faster image generation without the need for expensive GPUs. Choose the option that suits you best and enjoy.",Freemium,Image generation,"Generate high-quality images with an easy to use and affordable API.
Create artwork with AI-generated images.
Access diverse models for image generation in your application."
Roam Around,https://topai.tools/t/roam-around,"Roam Around is an AI travel planner that is designed to make travel planning a breeze. With Roam Around, you can eliminate the hassle of planning and start exploring the world with ease. Roam around travel planner helps craft hyper-customized travel plans that cater to your specific needs and preferences.

Whether you're looking for a pet-friendly itinerary in London for 3 days, a budget-friendly trip to Jaipur for 2 days, a honeymoon in Bali for 5 days, a jam-packed European adventure for 10 days without visiting museums, a family-friendly itinerary in Rome for 4 days, or any other type of trip, Roam Around has got you covered.",Usage based,Travel,"Plan personalized travel plans easily and quickly.
Create a budget-friendly trip to any location.
Design a honeymoon or family trips without any hassle."
PaintIt Interior Designer,https://topai.tools/t/paintit-interior-generator,"With PaintIt AI interior design generators you will be able to generate interior design ideas in minutes and for free so it is accessible to everyone. Just upload a picture and start generating ideas. Users can generate personalized interior design visualizations from their own room photographs quickly. By combining user creativity with advanced AI technology, paintit.ai offers a premium, tailored design experience without the costs of traditional interior design services.",Free,Real Estate,
Qlone,https://topai.tools/t/qlone,"qlone is a user-friendly 3D scanning app that allows users to scan objects and create AR menus. It integrates with leading 3D platforms for printing, sharing, and selling 3D models. The app supports multiple languages and is available for download on Mac devices.",Visit Site,3d,"Scan objects and create AR menus.
Print, share, and sell 3D models.
Access FAQ section for questions and feedback."
Algorithm Rank Validator,https://topai.tools/t/algorithm-rank-validator,"The Algorithm Rank Validator is an AI tool designed specifically for Twitter developers. This tool allows developers to view and contribute to the algorithm that Twitter uses to prioritize tweets on users' feeds. By using the Algorithm Rank Validator, developers can gain insights into how their tweets rank in Twitter's open-source algorithm.

The main purpose of this tool is to evaluate tweet rankings. By examining the positive rankings obtained, developers can gain a better understanding of how to improve the reach and engagement of their tweets. The tool assigns a score of 0, indicating the current rank of a specific tweet.

With the Algorithm Rank Validator, developers have the opportunity to make data-driven decisions when it comes to their Twitter strategy. By analyzing the ranking of their tweets, they can fine-tune their content and engagement tactics to ensure maximum visibility and interaction.

Overall, the Algorithm Rank Validator is a valuable tool for Twitter developers who want to optimize their tweet performance. It provides valuable insights into how tweets are ranked and offers an opportunity to enhance their reach and engagement on the platform.",Free,Developer tools,"Evaluate tweet rankings.
Improve tweet reach and engagement.
Make data-driven Twitter strategy decisions."
SpamSpy,https://topai.tools/t/spamspy,"SpamSpy is an AI-powered anti-spam tool that focuses on detecting and preventing spam emails and malicious content. With its evolving detection system, SpamSpy provides the best spam protection. It works by learning constantly from submitted spam content and notice trends to better protect its users.

SpamSpy makes it easy to fight spam with its streamlined and snappy integrations, ensuring fast response times and efficient data processing. Its training data is robust, with gigabytes of community-submitted data for the AI to learn from.

Using SpamSpy is simple and straightforward. Users can connect their data to SpamSpy via RapidAPI and contribute to the fight against spam. Submitted spam content is then processed and used to train the AI for future queries and spam detection.

SpamSpy offers flexible pricing options to fit the needs of different users and tech stacks. Users can contribute to the training data for free or choose from Pro, Ultra, or Enterprise plans for added benefits and support.",Freemium,Email,"Detecting and preventing spam emails.
Blocking malicious content.
Providing spam protection."
CrystalSound,https://topai.tools/t/crystalsound,"Crystalsound is an AI-powered voice enhancement tool designed to improve voice clarity and eliminate unwanted noise in audio recordings. With its advanced ""voice"" feature, crystalsound effectively filters out background noise, allowing the user's voice to shine through.

This tool is useful in noisy environments and group settings, making it easier to transcribe, edit, and listen to audio files. crystalsound utilizes deep neural network technology, for maximum accuracy.

Crystalsound commits to privacy. All processing happens locally on the user's device, ensuring that no data is ever sent to a third-party server.

With its easy-to-use interface, crystalsound can be installed and operated with just a few clicks. It integrates with popular communication apps like Google Meet, Zoom, Teams, Slack, Skype, Zalo Desktop, and Discord, making it a versatile solution for various use cases.",Freemium,Audio Editing,"Transcribing audio files to text.
Editing audio recordings and enhance audio quality.
Improving audio quality in group settings like meetings and presentations."
Inbox Narrator,https://topai.tools/t/inbox-narrator,"Inbox Narrator, an AI tool that improves your email experience by delivering human-level summaries of your inbox via voice assistant. With Inbox Narrator, you can start your day smoothly by simply listening to the important content of your unread emails, ensuring you never miss a beat.

Using AI technology, Inbox Narrator intelligently summarizes your emails in a smooth and pleasant voice. It's like having your own personal AI assistant helping you start your work day.

Getting started is quick and easy. Simply create an account, connect your Gmail, and complete the subscription process. Once set up, you can command Siri or Google Assistant to fetch your email summaries every morning.

They commit to keep your email data safe and secure.",Subscription,Email,"Get summarized email content via voice assistant everyday.
Start your day with important email summaries that you can listen to while anywhere.
Enhance email productivity with AI summaries to prioritize the important tasks."
Hello AI,https://topai.tools/t/hello-ai,"Hello AI is a chatbot assistant app that aims to boost productivity, help users learn new skills, and maximize their potential. Hello AI offers a personalized and intuitive chatbot experience that feels like talking to a real person.

The app provides instant 24/7 support for a wide range of needs, including planning travel itineraries, solving math problems, and generating start-up ideas. Hello AI is incredibly accurate in understanding natural language context and provides responses in seconds. Whether you need help with a math problem, writing essays or emails, Hello AI is there to assist.

Some of the main use cases for Hello AI include personal productivity, health and wellness, finance and budgeting, and education and learning. The free version of the app may have limitations, but subscribing to Air Apps One provides access to all the features and removes ads.

Hello AI offers a diverse range of apps covering various categories such as productivity, learning, fitness, and creativity. Users can choose different plans, including a 1-week, 1-month, or 1-year subscription. The subscription payments are charged through the iTunes account.",Free trial,AI Assistant,"Use the chat app for planning travel itineraries on the go.
Helps with quick questions throught out the day like solving math problems, answering questions and more.
Generating ideas or just personalized chat for fun."
Seazn,https://topai.tools/t/seazn,"Seazn, the ultimate cooking companion that turns your ingredients into delicious meals. No food waste, long grocery lists, and complicated recipes. Seazn, will give you everything you need to whip up delicious meals in quickly. Whether you're a novice in the kitchen or a seasoned pro, Seazn is the perfect app for you.

Seazn uses AI technology to generate personalized recipes based on the ingredients you already have at home. With just a few taps, you can discover new recipes that match your taste preferences. Seazn is a smart cooking assistant that learns your cooking habits and continuously updates its knowledge. You can filter recipes by meal type and cooking time, making it easy to plan meals and save time in the kitchen.

By using Seazn, you save time and money, and you'll also reduce food waste. It'st the app for anyone who wants to cook delicious meals with minimal effort.",Free,Recipes,"Discover new recipes based on ingredients.
Filter recipes by meal type and cooking time.
Reduce food waste and save time in the kitchen."
