tools_names,urls,what_is,pricing,tags,use_cases
AI-Speeder.Com,https://topai.tools/t/ai-speeder-com,"The AI Speeder is an AI tool that focuses on generating unique content and images quickly and efficiently.With over 60 content creation templates, users can create SEO-optimized content for various purposes such as blogs, ads, emails, and websites.

The tool offers features like article writing, rewriting, outlining, and summarizing, making it suitable for writers, bloggers, and content creators.Additionally, it provides tools for social media posts, marketing tools like Facebook and Google ads, and email campaigns.

The AI Speeder also offers features like tone changing, translating content into different languages, generating FAQs and answers, and creating testimonials and reviews.",Freemium,Content Creation,"Create SEO-optimized content for your personal and business blog.
Generate engaging articles quickly that are uniquely written for your business.
Improve content creation efficiency by using pre-written templates."
Video2Quiz,https://topai.tools/t/video2quiz,"Video2Quiz is an AI tool that allows users to create quizzes based on videos in just seconds. By separating information into quizzes, Video2Quiz simplifies the learning process. It is suitable for individuals and organizations looking to enhance their training and education initiatives.",Free trial,Education,"Create quizzes based on videos.
Convert lectures and video tutorials into validate learnings through quizzes.
Enhance training and education initiatives within an organization by offering quizzes."
Puddl,https://topai.tools/t/puddl-io,"Puddl is an AI tool that focuses on providing insights and reducing costs for OpenAI users.It offers a free sign-up option to track OpenAI costs and provides a detailed breakdown of costs on a daily, weekly, and monthly basis.

Users can localize costs in their native currency, eliminating the need to convert to USD.The tool also provides request token-level details for model-wise spends, allowing users to analyze their costs at a granular level.

Puddl's features include a sleek playground where users can create, test, and iterate on prompts.They can save different versions of prompts and use annotations to track the history of their requests.Additionally, puddl offers a Python library that enables users to send LLM (Language Learning Model) requests, track their history, and annotate them for deep analytics.",Free,Data analysis,"Track OpenAI costs with analytics and optimize them.
Create and test prompts as you do.
Analyze LLM request history for analysis and insights."
SuperAGI Cloud,https://topai.tools/t/app-superagi-com,"SuperAGI cloud is a platform that provides similar features to the open source SuperAGI but on the cloud, with additional features on top of it, like a Marketplace for agent templates, toolkits, and embeddings.

You can signup using Github and get started directly without having to use Docker.The platform also includes a graphical user interface (GUI) for easy management and interaction with agents.SuperAGI cloud allows developers to create multi-model agents that can be tailored to specific tasks and supports multiple Vector DB connections to improve agent performance and data access.

It also provides performance telemetry and emphasizes effective token management, and has looping detection heuristics.Additionally, a resource manager is included for efficient data management and analysis.",Free,Automation,"Developing multi-model agents for specific tasks fully in the cloud.
Provides efficient data management, retrieval and analysis.
Optimising your AI agent performance and data access without installing anything."
BrightBot,https://topai.tools/t/brightbot,"Brightbot is an AI-powered chatbot tool that helps increase conversions and engage prospects on websites.It allows users to quickly add a chatbot that can answer questions in real-time, even when the team is unavailable.

The tool provides immediate responses and can be easily trained with text data to answer questions on various topics.Brightbot's key features include an admin panel to effortlessly manage the chatbot, the ability to import text to train the chatbot, and monitoring capabilities to keep track of conversations.

Users can customize the chatbot to match their branding and benefit from its 24/7 presence, providing fast response times and reducing the workload on the team by handling routine queries.To use Brightbot, users need to copy and paste the provided embed code into their website.

The tool is cloud-based and can be accessed through a web browser.Brightbot offers a free plan to get started, and as usage grows, users can choose from paid subscription plans.Payment can be made via credit card, invoice, or bank transfer.

Brightbot is a product of Bright Interactive Limited and provides a user-friendly platform for training and managing chatbots.For more information, users can contact Brightbot's support team or visit their website.",Freemium,Chat,"Increase website conversions.
Engage prospects in real-time.
Answer questions on various topics."
Logo Diffusion,https://topai.tools/t/logo-diffusion,"The Logo Diffusion AI tool allows users to create custom logos within seconds.It uses generative AI to generate unique and original designs based on simple text prompts.Users can receive four logo options per prompt and can generate new designs until they find one they love.

The tool also offers logo redesign capabilities, allowing users to describe their redesign ideas and bring them to life.It can convert 2D logos into stunning 3D illustrations, perfect for boosting brand recognition.

The Content Styles feature helps guide the logo design process, ensuring that the AI-generated logos perfectly reflect the user's vision.The tool also provides vector conversion to create industry-standard vector files of the generated logos.

Users can easily remove the background of the logo and receive a transparent PNG file.There is a browser editor in development, which will allow users to develop logo design ideas without the need for external editing software.",Freemium,Logo Generator,"Create custom logo desgins.
Redesign logos with AI.
Convert logos to 3D illustrations automatically."
InterviewBot,https://topai.tools/t/interviewbot,"Interviewbot is an AI tool designed to help users prepare for interviews.It offers a range of features, including the ability to select industry-specific questions and practice using relevant questions from HR.

The tool allows users to choose from a selection of avatars, each with its own unique style and personality.Users can also customize the prep time for their interviews, ranging from zero seconds to 10 seconds.

For those who want to further improve their interview technique, Interviewbot offers subscription options, including access to AI coaching tips.The tool also provides the ability to playback and re-record interviews, allowing users to review their performance and make improvements.",Free trial,Job Search,"Select industry-specific questions.
Practice using relevant HR questions.
Playback and re-record interviews."
Unboring.Ai,https://topai.tools/t/unboring-ai,"Unboring AI is an online face swapping and photo animation tool that allows users to easily transform their photos and videos using AI technology. With just a few clicks, users can swap faces in photos and videos, create funny content, and make their photos talk and dance. The tool offers a wide range of AI filters that can turn ordinary videos into captivating works of art with a charming cartoon or anime-inspired aesthetic. Users can also transform their pet's pictures into delightful cartoon characters and bring a smile to their face with charming creations. The tool is user-friendly and does not require any professional editing skills. Users can restyle their videos, swap faces, and animate their photos effortlessly.",Usage based,Image Editing,"Swap faces in photos and videos with any face you like.
Create funny and engaging images and animations.
Animate photos and videos easily with AI."
Emusion,https://topai.tools/t/emusion,"""Emusion"" is a music recommendation tool developed by freshly.ai.It combines AI technology with human input to provide personalized music recommendations based on users' musical preferences.Users can enter three songs that resonate with their soul, and Emusion will suggest new favorite songs that match their music taste.

The tool also gives insights into the mood and qualities of the recommended music.Emusion is part of a collection of AI tools offered by freshly.ai, including prompt museum, prompt-to-game, and what-a-prompt.",Free trial,Music,"Discover new favorite songs based on user's musical preferences.
Get insights into the mood and qualities of recommended music.
Explore AI technology in the field of music recommendation."
Purple Wave,https://topai.tools/t/purple-wave,"Purple Wave is an AI tool that helps businesses supercharge their digital marketing efforts.It allows users to instantly generate marketing assets and create complete sales funnels, including sales pages and email campaigns.

Purple Wave serves the needs of digital marketing teams, providing them with the latest innovations and a competitive edge in today's marketplace.With Purple Wave, users can automate their email marketing campaigns, delivering personalized content that resonates with their audience and drives results.

The platform also integrates with Stripe, enabling businesses to collect payments, offer subscriptions, and upsell to increase revenue.Additionally, Purple Wave offers user-friendly apps for Apple Store and Google Play, allowing businesses to reach millions of potential users across various devices.",Subscription,Marketing,"Generate marketing assets quickly to test your ideas.
Create sales funnels automatically.
Automate email campaigns and create your landing pages."
Text2SQL.AI,https://topai.tools/t/text2sql-ai,"text2sql.ai helps with generating SQL queries.You can generate SQL queries from plain text instructions, saving time and improving SQL skills.The tool supports various use cases, such as finding users who live in California with more than 1000 credits.

It also offers the ability to generate SQL queries that translate complex language into SQL and can explain SQL queries in plain English.The tool is compatible with popular database types like MySQL, PostgreSQL, Snowflake, BigQuery, and more.

Additionally, text2sql.ai can generate Excel formulas, Google Sheets formulas, and regex expressions.It offers a range of pricing plans, including a free option, and provides features like AI SQL generation, explanation, optimization, error fixing, and support for custom database schemas.

The tool finds application for beginners learning SQL and professionals in roles like data analysts, data scientists, data engineers, and software developers.Despite using state-of-the-art natural language processing, the tool's output may sometimes be inaccurate, and users are encouraged to check and refine the generated queries.",Free trial,SQL,"Generating SQL queries from plain text instructions.
Translating complex language into SQL.
Explaining SQL queries in plain English."
Saga,https://topai.tools/t/saga,"Saga is an AI-powered text-based RPG tool that allows users to create and play interactive fiction adventures.It offers immersive roleplaying experiences with customizable settings, where users can choose from a wide variety of pre-existing worlds and characters from popular franchises.

The tool features dynamic conversations with AI-enhanced characters, allowing for organic and dynamic dialogues that deepen the user's involvement in the game's universe.Additionally, saga provides a free-form writing experience, supporting the user's creativity while enriching the narrative and preserving their unique voice and style.

saga is cross-platform, with a web app that can be accessed and played on any device, including PCs, mobile phones, and tablets.The tool also includes AI-generated illustrations that visually represent key events, characters, and locations throughout the adventures.",Free,Gaming,"Create and play interactive fiction adventures.
Immersive roleplaying experiences with customizable settings.
Dynamic conversations with AI-enhanced characters."
Felix.App,https://topai.tools/t/felix-app,"Felix is a Slack AI assistant that uses generative AI to help with writing in Slack.You can set the context and preferred tone and writing style, while Felix takes care of the rest.It can be installed and customized by individual users or for the entire workspace.

Users can write custom prompts, choose the tone of the messages, fix spelling and grammar mistakes, and even select fun characters.Felix automatically corrects spelling and grammar mistakes and provides message previews.",Freemium,AI Assistant,"Correcting spelling and grammar mistakes in Slack messages.
Providing message previews in Slack.
Assisting with writing in Slack in your preferred tone of voice and style."
Ree AI,https://topai.tools/t/ree-ai,"Ree is a health assistant AI.It is free to use.ðŸ‘‰ Ree can explain medical reports (lab test results, etc.) ðŸ§ª, recommend supplements ðŸ’Š, check drug interactions âŒ and much more.Users can copy and paste patient data or result text into the tool's input field and ask specific questions or request an overall assessment.

If the tool is hesitant to answer a question, users can insist assertively by repeating the query.It is important to note that the information provided by the AI assistant is not meant to replace advice from a medical professional.",Free,Health,"Explain medical reports easily in natural language.
Get supplements recommendations for improving overall health status.
Check drug interactions information to ensure safety."
Stream Routine,https://topai.tools/t/stream-routine,"Streamroutine is a powerful ai tool that offers a chatbot feature specifically designed for twitch streamers. with streamroutine, you can easily tie your chatbot directly to your streamroutine account, allowing you to manage your chat logs and create custom commands. the chatbot is powered by chatgpt, making it an efficient and reliable tool for streamers. Whether you want to brainstorm ideas for your stream or simply want to chat and have a rap battle challenge, Streamroutine can make your streaming dreams come true.

in addition to its powerful features, Streamroutine also has a community-driven approach, with a dedicated discord server where you can connect with other streamers. the tool is compatible with popular platforms such as twitch, tiktok, instagram, youtube, and facebook, allowing you to expand your reach across multiple channels.

overall, Streamroutine is an excellent ai tool designed specifically for twitch streamers. it offers features like chatbot integration, custom commands, and chatgpt-powered capabilities, making it a valuable asset for enhancing your streaming experience.",Free trial,Chat,"Manage chat logs and create custom commands for your twitch streaming.
Brainstorm ideas for streams.
Connect with other streamers ."
Portaly,https://topai.tools/t/portaly,"Portaly is an AI that allows users to create personalized link-in-bio pages with just one click. Users can input their website profile URL and the AI will swiftly generate a fully customizable landing page. This tool integrates with 20+ platforms and is compatible with various log-in options. It is ideal for creators and businesses looking to create a professional and customizable link-in-bio page. Portaly offers a beta build link and provides an easy-to-use interface for generating AI-powered landing pages. It also offers additional features such as blog integration, contact options, and a Chinese version.",Visit Site,Social media,"Create professional link-in-bio pages.
Customize generated landing pages based on personal information.
Integrate blog and contact options within your bio page."
Knit,https://topai.tools/t/knit,"Knit is an AI tool that helps users manage and build prompts for various AI models.It offers a centralized workspace where users can store, edit, and run prompts without the need for copy-pasting.The tool supports playground mode, allowing users to play with prompts and see actual function calls with mocked values.

It also provides project management features, allowing users to create different projects to organize their prompts and collaborate with team members.With version control, users can track the history of every prompt and revert to previous versions if needed.

knit prioritizes security, with sensitive data encrypted during transmission and storage using RSA-OAEP AES-256-GCM.While currently supporting models like openai and claude, knit plans to include more models in the future.

Additionally, users can insert multiple variables in their prompts, and knit will handle the rest.",Free,Prompt Guides,"Manage and build prompts for AI models.
Play with prompts and see function calls.
Track prompt history and revert to previous versions."
Research Studio,https://topai.tools/t/research-studio-ai,"Research Studio will transform your data into actions.It delivers rapid, AI-Powered research analysis for UX, Marketing, and Product people.Everything from summaries, insights, sentiment, personas to competitors & data diagrams.

Key features include drag-and-drop file upload, AI-driven summarization, sentiment analysis data extraction, AI chat for natural conversations, insights and takeaways, and simple pricing.The tool automates tasks like summarizing documents, extracting data, and facilitating natural language interaction.

It provides valuable insights on user personas, data diagrams, and offers cloud synchronization for informed decision-making.With AI technology, Research Studio streamlines research processes and enhances productivity for UX designers and product managers.",Freemium,Startup tools,"Drag & Drop Research Files to get summaries and insights from research files..
Chat with your research documents and data for faster insights.
Extract sentiment analysis from long interviews and conversations to understand users and improve products."
Forms.App,https://topai.tools/t/forms-app,"Forms.app AI form generator is an AI-powered form builder that simplifies the process of creating online forms, surveys, and quizzes.With no coding required, users can generate customized forms by providing prompts to the AI.

The tool automatically generates the form, including question options based on the provided titles.It also offers the ability to create unique images for forms and analyze form results for data-driven decision-making.",Free,no-code,"Create online forms, surveys, and quizzes effortlessly for marketing, sales or educational purposes.
Generate customized forms without coding and embed anywhere.
Analyze form results for data-driven decision-making."
AppGenius.Ai,https://topai.tools/t/appgenius-ai,"AppGenius is a no-code platform for effortlessly building and deploying AI-based interactive content on your website. Create captivating calculators, product recommenders, and more! Entice your audience and collect leads with immersive AI-enhanced experiences.

The tool allows users to easily create and customize new apps in minutes and embed them on their existing HTML site.It also enables the capture of qualified leads by offering engaging AI-powered content to potential customers.

Users can collect emails, first names, last names, and phone numbers to convert their website into a lead magnet powered by generative AI tools.AppGenius can also be used to create interactive and personalized experiences for customers, such as recommending products and providing industry insights all without requiring coding skills.",Freemium,No-code,"Create and add interactive apps to your website without any code.
Collect qualified leads on your site using various embeds.
Customize UI and prompts via the app without changing codebase."
Typeblock,https://topai.tools/t/typeblock,"Typeblock is an AI tool that allows users to build and share AI apps without the need for coding or expensive developers.It handles hosting, database management, and deployment, making it easy for users to get started.

The tool offers various features and use cases such as SEO blog post writing, generating highly personalized cold emails for sales teams, writing highly converting social media posts for platforms like Facebook, LinkedIn, and Twitter, creating landing page copy for marketing teams, and harnessing the power of AI to write engaging newsletters for users.",Freemium,No-code,"Create AI apps and add to your websites without code.
Easily create personalized AI apps to augment features on your site .
Create social media post writing apps, email writing and more."
Tracksy,https://topai.tools/t/tracksy,"The tracksy AI music generator helps creators bring their ideas to life through music.It uses generative AI technology to assist users in easily creating unique music, regardless of their level of experience.

With tracksy, you can start creating music for free today.It offers a variety of styles, durations, moods, and genres to choose from, such as electronica, lit savage, and EDM.The tool allows you to customize the music according to your preferences and provides options to discard, save, skip, play, and load tracks.

It also offers a volume control feature.The tracksy AI music generator is the leading tool in the world for generating music using AI technology.Use cases for this tool include music production, content creation, background music creation, and audiovisual projects.

It is suitable for both experienced musicians and beginners who want to add unique music to their creations.The tool is user-friendly and offers a wide range of options to create music that suits your needs.",Free trial,Music,"music generator.
ai music creator.
audio track generation."
Rooms,https://topai.tools/t/rooms,"Rooms.xyz is a web-based tool that allows users to create and remix interactive rooms in their browser.The tool has a wide range of features that enable users to build customized rooms by choosing from hundreds of items to add.

Users can create and remix anything they want, and even view the source code to make changes and customize how things work.The tool also provides the option to share room links and playback on desktop and iOS devices.",Visit Site,3D,"Create and design interactive rooms in 3D.
Remix existing rooms to inspire and test new styles.
Share room links and playback on desktop and iOS devices for generated designs."
NumerousFlow,https://topai.tools/t/numerousflow,"NumerousFlow helps streamline repetitive tasks involved in content generation using chatgpt.It achieves this by creating workflows that can perform different actions based on chatgpt input prompts.NumerousFlow is an advanced automation tool that saves time and increases efficiency for bloggers, copywriters, content marketers, influencers, and social media managers who regularly generate content.

It automates routine processes such as formatting text, generating summaries, FAQs, and more.By eliminating the need for manual writing of repetitive tasks in chatgpt, NumerousFlow simplifies the content generation process, saving valuable time.

The tool allows users to create and save flows, providing input prompts/text, selecting the flow, and running it to automate tasks.It can be used to generate food recipes or perform any other repetitive content generation task.

NumerousFlow has a user-friendly interface that makes it easy to create workflows and use features like formatting text, generating summaries, writing emails, titles, recipes, video scripts, and adding links automatically.

Users can create multiple flows and access the history of generated content to streamline the content generation process.NumerousFlow boosts your productivity by automating repetitive content generation tasks and reducing the need for manual typing.

It simplifies the content generation process, reducing the time it takes to complete tasks and allowing businesses to be more productive and focus on important areas.Additionally, since fewer resources are needed to perform tasks, businesses can save money by reducing labor costs.

NumerousFlow also offers easy sharing and export features, making it simple for users to share their generated content with others.Users can easily copy, download, and share the generated content on social media or publish it elsewhere.",Freemium,Automation,"Automating content generation tasks.
Streamlining repetitive tasks in content generation within chatGPT.
Increasing efficiency in content generation by using workflows within chatGPT."
