tools_names,urls,what_is,pricing,tags,use_cases
B2BRocket,https://topai.tools/t/b2brocket-ai,"B2B Rocket AI is an innovative AI tool designed to boost the B2B sales process. B2B Rocket AI's proprietary AI agents autonomously navigate the entire sales lifecycle, from lead identification to conversion. This powerful tool effortlessly and efficiently drives revenue skywards by harnessing the power of AI in the global marketplace.

B2B Rocket AI's AI agents offer a range of features and use cases. Users can customize their AI agent by defining target audience criteria and crafting compelling sales pitches. The AI agent then strategically identifies potential clients that match the defined criteria and initiates conversations to assess their interest and qualify potential leads. Using advanced AI algorithms, the agent evaluates prospects' responses to ensure they meet predefined criteria.

The AI agent interacts with thousands of prospects, intelligently understanding and responding to their queries through natural language processing and machine learning. It maintains engagement and nurtures interest through personalized and relevant interactions, building trust and rapport with prospects. The AI agent can also conduct autonomous chat sessions and set up personalized meetings with prospects, handling logistics and scheduling efficiently.

If you're ready to skyrocket your B2B sales process on autopilot, unlock your sales potential with B2B Rocket AI.",Subscription,Sales,"Customizing AI sales agent for target audience.
Crafting compelling sales pitches.
Identifying and qualifying potential leads.
Setting up personalized meetings with prospects."
WPTurbo,https://topai.tools/t/wpturbo-dev,"WPTurbo gathers WordPress development tools to help website creators to ship them faster. The main tool is WPTurbo AI: a WordPress snippet generator. Users can generate code in PHP, JS, CSS and HTML language, then save them individually or together as a project. A chat is included in the interface to let user discuss to refine the outputed code. On top of that, it offers 40+ free WordPress code generator to customize any website using WordPress best practices.

Whether you need to create a custom plugin, customize a theme, or add functionality to an existing website, WPTurbo generates tailored code snippets in seconds. This saves developers from the time-consuming task of manual coding, resulting in faster development cycles and reduced errors.

One of the key features of WPTurbo is its snippets library, where users can store and manage their frequently used WordPress code snippets, including the ones generated by WPTurbo AI. This centralized and organized space ensures uniformity in design and functionality, leading to more professional and polished websites.",Freemium,Developer tools,"Generate code snippets for WordPress development.
Organize and manage WordPress code projects.
Create theme and plugin boilerplates for new projects."
BrainyPDF,https://topai.tools/t/brainypdf,"BrainyPDF is an AI tool that helps you chat with any PDF document. It allows students, researchers, and professionals to instantly find answers and understand research within PDF documents through a chat-like interface. With BrainyPDF, you can drop in your PDF file and browse it as if you were having a conversation with an AI assistant. The tool can summarize and answer questions for free.

For students, BrainyPDF is a valuable resource for exam preparation, homework help, and multiple-choice question answering. Researchers can benefit from easily accessing information within scientific papers, academic articles, and books, aiding their research process. Professionals can also find relevant information within scientific papers, academic articles, and books to support their work.

BrainyPDF supports multiple languages, making it accessible to users worldwide. Answers provided by BrainyPDF are backed by sources and include references to the original PDF document, ensuring credibility. The tool offers a simple, secure, fast, and free experience with files securely stored in the cloud.",Free,Chat,"Students can chat with PDF docs for exam preparation.
Researches can ingest new research PDF documents quickly and easily.
Save time on reading long documents by finding answers in a chat interface.
Accessing information within scientific papers easily by asking questions."
InterviewAI,https://topai.tools/t/interviewai,"InterviewAI is an AI-powered platform that revolutionizes the interview process. With its real-time AI-generated questions, InterviewAI makes it easy to conduct efficient and effective interviews, helping you find the best candidate for the job.

Getting started is simple - just enter the candidate's information and select the role you're interviewing for. Instantly, you'll receive tailored interview questions, including AI-generated follow-up questions. You can view and save the interview summary for future reference or copy it to your preferred ATS system.

With InterviewAI's powerful features, you can supercharge your interviewing skills. The platform offers real-time AI-generated questions that are relevant to the job category and position you've selected. It also provides a question library with a vast collection of interview questions, saving you time and giving you a starting point for customization.

Additionally, InterviewAI has interview management tools to help you keep track of candidate notes, questions, and follow-up questions. This makes the whole process feel seamless and professional.

Uncovering valuable insights is made easy with InterviewAI's smart follow-up questions, which dig deeper based on the candidate's responses. This feature helps you make better-informed hiring decisions.",Visit Site,Human resources,"Conducting efficient interviews with ease.
Finding the best candidate for the job.
Saving time with interview question library.
Managing candidate notes and questions.
Making better-informed hiring decisions."
Machined.Ai,https://topai.tools/t/machined-ai,"Machined.ai is an AI-powered tool that automates the process of building content clusters. With just a few clicks, it can write entire content clusters on any topic and for any audience. This content generation tool can produce hundreds of quality, interlinked articles that are ready to be polished and published.

Machined.ai offers a range of features designed to boost your SEO strategy. It analyzes the latest keyword data to create effective clusters that rank high in search results. It also conducts automated keyword research based on advanced analytics. Additionally, it carefully chooses keywords that work well together, boosting your ranking without cannibalization.

The tool also offers control over perspective and tone, ensuring that the content aligns with the intended audience and purpose of writing. It supports over 100 languages, making it a truly global solution.

Machined.ai is fast, scalable, and flexible. It can handle bulk writing, allowing you to write hundreds or even thousands of articles at a time. In addition, the tool offers automated internal linking, ensuring a natural flow within your content cluster.

The tool also has a roadmap for future enhancements, with a dedicated team actively working on adding new features every week. It integrates seamlessly with WordPress, making it easy to publish entire clusters of articles directly to your WordPress site. Furthermore, it offers search integration and SERP analysis for even more powerful keyword research and contextual linking.",Free trial,Content creation,"Automated content cluster generation.
SEO-driven content creation on scale with content interlinking.
WordPress integration."
MyShell,https://topai.tools/t/myshell,"MyShell is an innovative chatbot platform that allows you to create personalized chatbots called Shell. With MyShell, you can create interactive and immersive chatbots by blending versatile components to construct useful and entertaining bots tailored to your needs. You can also share your chatbots with friends and the MyShell community.

MyShell offers a wide range of features, including customizable knowledge integration, voice studio, infinite memory, internet and API integration, and multimodal integration. These features enable you to create chatbots that can interact intelligently with users, access information from external sources, and provide a seamless user experience.

MyShell provides the tools necessary to create chatbots that can handle complex dialogues and deliver accurate information in a conversational manner.",Usage based,Chatbots,"Creating personalized chatbots.
Create AI characters to chat with on different topics."
Mst.Ai,https://topai.tools/t/mst-ai,"Ministerai is a free online AI art generator that allows you to unleash the power of your imagination and push beyond limits. With just one click, you can create awe-inspiring AI artworks instantly. Leveraging advanced AI technology, Ministerai creates stunningly realistic images of unmatched quality. Whether you are a skilled artist or a beginner, Ministerai empowers you to unleash your creativity without compromising on precision and quality. Welcome to the new era of digital art with Ministerai.

Ministerai offers a large number of stable diffusion AI art models, both provided officially and shared by platform users, all available for free use and download. These models include various styles such as anime, fantasy, movie and photography, buildings and backgrounds, realistic vision, and more. You can also find distinctive styles like the Samdoesarts (Sam Yang) fashion style and the Blindbox Lora style.

Built on a stable diffusion framework, Ministerai is an efficient, accurate, and unique AI drawing tool. It supports the use of multiple models, allowing you to present your artwork in various styles. You can also train personalized models and share excellent models with the community of users. Experience the endless possibilities of creating artwork with Ministerai.",Free,Art Generation,"Create stunning AI artworks instantly.
Unleash your creativity with precision and quality.
Explore various art styles and models.
Train personalized AI art models."
Zentask,https://topai.tools/t/zentask,"Zentask is an AI-powered solution that simplifies work and boosts productivity. It offers a range of features and solutions to help streamline workflows and save time and energy. With Zentask, you can create unique textual content and visuals with just one click, making it ideal for professionals in various fields. The platform also supports real-time context creation for articles and images, making it easy to generate engaging content for blogs, businesses, and marketing copies.

Zentask is an all-in-one AI solution platform that enables you to develop unique content using diverse AI resources. Whether you need to compose, investigate, evaluate, or produce visuals, Zentask has got you covered. It allows you to write articles and marketing copies 10 times faster while ensuring they are SEO-friendly and plagiarism-free.

With Zentask, you can also boost your site's success with SEO magic by refining keywords, generating meta tags, and crafting engaging articles. It supports various settings and customizable options, including language selection and voice tone, to help you achieve maximum online visibility.

Additionally, Zentask offers the ability to create and organize prompt templates, simplifying your workload and streamlining your daily routine. It comes with a user-friendly interface and is suitable for both desktop and on-the-go browser support.",Freemium,Content Creation,"Create unique textual content and visuals.
Generate engaging content for blogs and marketing copies.
Refine keywords and generate meta tags for SEO.
Create and organize prompt templates."
Copilot2trip.Com,https://topai.tools/t/copilot2trip-com,"Copilot2trip is an AI-powered personal travel assistant that helps you plan your trips with ease. With Copilot2trip, you can chat with the assistant to provide information about your intended destination, the length of your trip, and any additional preferences or circumstances. Whether you want to plan a 3-day itinerary in Dubai, create a list of the top attractions, find hidden gem tours and experiences, or simply navigate the city, Copilot2trip has got you covered.

The intuitive interface allows you to easily interact with the assistant, map navigation and zooming options. Copilot2trip utilizes accurate map data from Google and INEGI to provide you with precise information about your desired location.",Freemium,Travel,"Plan itineraries easily and quickly.
Find attractions based on taste and preferences.
Discover tours and experiences with the help of AI."
RizeMail,https://topai.tools/t/rizemail-app,"Rizemail summarizes your emails without you having to leave your inbox. No installs. For free. You simply forward your unread newsletters or long emails to summ@rizemail.app and you get a concise AI-generated summary back as a reply. Once your emails is processed we delete any trace of it to ensure your privacy. Rizemail is the tool for you if you want to spend less time wading through useless information and want to get to the core of your emails. Save your time, summ@rizemail now.

The best part? It's completely free! Currently, Rizemail allows you to summarize up to 100 mails per month per email account. Rest assured that your emails and data are secure with us, as we delete them immediately after summarization.

While Rizemail serves modest ads at the bottom of the provided summaries to keep the service free, an ad-free premium service with extra features is coming soon. When you use Rizemail, your email is only used to summarize it, nothing else.

Amazon Web Services (AWS) will receive your emails and trim the core body for our AI tool, OpenAI's GPT3.5 Turbo, to summarize. Once AWS returns the summary, it deletes all traces. Your email addresses are encrypted and stored as a hash, ensuring no one can see the content of your emails. The list of hashed emails is deleted every month.",Free,Email,"Quickly summarize emails.
Manage long email threads and get the gist of it.
Organize commercial communications.
Summarize newsletters to get the core message quickly."
TopAI.Tools,https://topai.tools/t/topai-tools,"topAI.tools is one of the best and largest AI tools aggregators and search engines, it lists thousands of AI tools in the AI web directory in different categories. topAI.tools search bar is powered by AI so that you can find the tool you are looking for at any time for any given task. On the website you can also bookmark different tools in addition to creating short lists of AI tools stacks that you can export and share with your team or use to compare different tools.

If you are an AI app or tool creator you can also submit your tool to the topAI.tools directory to get it listed and promote it to thousands of users every day.",Free,Aggregators,"Find AI tools for specific tasks.
Bookmark and compare AI tools.
Submit AI tools for listing and promotion."
ProAI Image Generator,https://topai.tools/t/proai-image-generator,"ProAI is an AI image and art generator, that can be used to generate free images, with different use cases, such as, digital art, social media content, advertising, photography, graphic design or print in demand.

The generated images are free to use commercially.Users are also able to choose from different model styles, aspect ratios, up to 4 generated images at a time, and upscaling up to 2x or 3x times more, through paid monthly subscriptions.",Freemium,Image Generation,"Digital art creation for different projects without design skills.
Social media content design generation from text prompts.
Creating advertising and marketing visuals easily."
GenixGPT - Travel AI,https://topai.tools/t/genixgpt-travel-ai,"GenixGPT is an AI travel planner that helps you discover the best hidden gems and off-the-beaten-path destinations for your next trip. With AI-tailored recommendations, it provides unique and truly personalized vacation suggestions in minutes. Stop endlessly sifting through search results on Google, as GenixGPT expertly discovers spots that perfectly align with your personal taste.

Whether you're looking for remote and rugged landscapes, stunning views, or untouched beauty, GenixGPT can help. It also uncovers hidden gems for you with the help of AI.

GenixGPT is an AI companion for your vacation planning, making it easier to find the perfect destinations. Its personalized recommendations and ability to uncover hidden gems will help you create truly memorable trips.Discover the best places for your next adventure with GenixGPT, made with love for passionate travelers.",Free trial,Travel,"Find personalized vacation suggestions with the help of AI.
Discover personalized hidden gems for travel easily.
Plan memorable trips easily without the hustle of searching.
Get personalized and unique travel recommendations for your next trip."
Coginiti,https://topai.tools/t/coginiti-co,"Coginiti AI is an AI data analytics assistant that helps users produce consistent high-quality insights faster. Coginiti's AI assistant enables users to generate SQL using natural language prompts, optimize existing SQL queries, explain shared SQL in the integrated catalog, give detailed explanations and solutions to errors, and explain query execution plans for better optimization.

The tool provides powerful query and analysis capabilities, allowing users to explore, manage, and analyze data in a collaborative data workspace. It also supports deep database and object store integration, providing easy access to data from various platforms such as Redshift, Microsoft, Snowflake, IBM, bigquery, Yellowbrick, and Databricks.

Coginiti AI is focused on enabling collaborative intelligence, believing in the future of intelligence being collaborative. The tool is built with responsible AI principles and has established proud relationships with partners. Coginiti also provides resources such as white papers, webinars, case studies, and a blog for users to learn and stay updated with the latest news and perspectives.

The AI advisor continually evolves based on every interaction, tailor-making recommendations and suggestions according to individual needs.

Coginiti AI also focuses on enhancing query performance to decrease compute costs. Users can ask the AI advisor for assistance in leveraging indexes, optimizing joins, and reducing response times. This enhanced performance translates into faster insights, improved resource utilization, and lower compute costs.",Free trial,Data analysis,"Simplifying SQL writing and making efficient queries for your data.
Accelerating data analytic products.
Enhancing query performance."
Everbility,https://topai.tools/t/everbility,"Everbility is an AI-powered documentation assistant designed specifically for occupational therapists. It streamlines the documentation process, allowing therapists to synthesize and summarize client notes and generate report sections quickly and efficiently. With Everbility, therapists can focus more of their time and energy on their clients' needs.

All notes and templates uploaded to Everbility are encrypted both in transit and at rest, ensuring the security of sensitive information. Additionally, client notes and templates are stored exclusively in Australia, with plans to expand to other regions in the future.

Everbility offers an AI-assisted writer and assistant to improve documentation efficiency. In addition, users can access the vast knowledge base embedded in Everbility to find the latest research and information relevant to their practice. The tool also helps therapists by summarizing and synthesizing client notes, allowing for quick and structured answers to queries.

With Everbility, therapists can save time, streamline their documentation process, and focus on providing quality care to their clients. The tool offers pre-defined report templates to easily generate professional reports, saving a lot of time and effort. Therapists can also save favorite questions and access them in conversations with the assistant, eliminating the need to start from scratch every time.",Freemium,AI Assistant,"Streamline documentation process for occupational therapists.
Synthesize client notes easily and quickly.
Generate report sections based on notes taken."
