tools_names,urls,what_is,pricing,tags,use_cases
Rasa.Io,https://topai.tools/t/rasa-io,"The rasa.io newsletter engages and grows relationships through content curated for each individual you send to. Whether your email list has 100 or 100,000 - everyone gets a set of articles chosen specifically for them. You can provide a real benefit regularly for everyone on your email list. And not just regularly, but relevantly. Through automation, you can engage with a new level of frequency and personalization without having to spend more time, effort, or money.",Subscription,Marketing,"Engage and grow relationships with personalized newsletters..
Curate content for each individual on your email list..
Automate frequency and personalization for efficient communication.."
Gift Ideas AI,https://topai.tools/t/gift-ideas-ai-xyz,"Gift Ideas AI is an easy to use gift finder that aims to make the process of finding the perfect gift for your loved ones easy and stress-free. Powered by an intelligent recommendation engine, this platform offers personalized gift solutions based on the interests of your loved ones in just a few minutes. With advanced AI algorithms, Gift Ideas AI takes into consideration their interests, age, gender, and special occasions to present you with personalized and curated gift ideas that match their unique taste. The platform offers a wide range of budget-friendly options to suit every price range, ensuring that you find the perfect gift without breaking the bank.

No more procrastination or last-minute gift hunting! Gift Ideas AI learns from your gift-giving history and sends timely reminders, helping you stay organized and prepared for every special occasion. The platform is also integrated with reputable e-commerce platforms and retailers, ensuring a secure and seamless shopping experience, so you can shop with confidence knowing that your transactions are safe.

Finding the perfect gift has never been easier. Gift Ideas AI understands the difficulty and effort involved in the process of finding the ideal present for your loved ones, and that's why they have created an AI-based system to assist you in identifying the perfect gift.",Free,Gift Ideas,"Find personalized gift ideas.
Get curated gift suggestions.
Stay organized with timely reminders for important occasions."
AIGPT Free,https://topai.tools/t/aigpt-free,"AiGPT_Free, experience boundless creativity with unlimited access - all for FREE!, this AI tool transforms your chat experience on different messenger platforms like Telegram or Whatsapp. No more memorizing complex prompts; AiGPT understands your needs and delivers accurate results effortlessly. Say goodbye to juggling multiple tools - AiGPT is your all-in-one solution for generating text, images, reports, and more. Enjoy endless fun as there are no usage limits. With a simple one-click setup, you're ready to chat and create with convenience at your fingertips!

AiGPT improves AI interaction, offering a gateway to limitless creative possibilities without hefty fees. Its diverse tools, from grammar fixing to generating reports and images, cater to various needs. Voice ChatGPT allows you to speak instead of type. The Magic Prompt feature generates perfect prompts from vague instructions using vast data. AiGPT is a mission to democratize AI, making it an everyday, indispensable tool for assistance, inspiration, and amazement.

Join the AiGPT today, turning every chat into a masterpiece. Explore, create, and transcend the ordinary with the extraordinary powers of AiGPT. Let your creativity soar with this remarkable AI tool. 🎉",Free,AI Assistant,"Generate creative content for chats on messenger platforms..
Simplify text, image, and report generation with AI..
Enhance communication and productivity using voice.."
Unstable Diffusion,https://topai.tools/t/unstable-diffusion,Unstable Diffusion is an AI image generator based on the stable diffusion model. It provides an unrestricted and uncensored image generation. With Ustability you can create any image you imagine from a text prompt and copy others' creations as well.,Freemium,Image Generation,"Generate unique images from text prompts using AI..
Explore unrestricted and diverse image creation..
Copy and modify others' AI-generated image creations.."
MediSearch,https://topai.tools/t/medsearch-io,"MediSearch is a Search engine for trustworthy medical information. Get direct answers to medical questions based on scientific articles. Does not diagnose or solve health problems, but very useful in finding health information.",Free,Health,"Find trustworthy medical information based on scientific articles..
Get direct answers to medical questions from reputable sources..
Access valuable health information for research and understanding.."
SlideSpeak,https://topai.tools/t/slidespeak-co,"Slidespeak is an AI tool that allows you to Chat with your PowerPoint files. Upload your data and ask any question about your PowerPoint slides. Let AI generate summaries, answer questions or get actions items out of any presentation.Summarize PowerPoint slides with AI. summarize slides, get information and much more.Transforming PowerPoint into powerful conversations. Upload, chat, and gain new insights from your presentations. Saving your hours of work.",Free trial,Presentations,"Generate AI summaries of PowerPoint slides.
Ask questions and get answers from your presentations and slides.
Gain insights and action items through AI-powered conversations from powerpoint presentations."
Essential,https://topai.tools/t/essential,"Essential is an open-source MacOS app developed by Getessential.app that serves as your co-pilot for your computer screen. It acts as a second set of eyes to help you with various tasks. With Essential, you can effortlessly remember information on your screen, understand what you are trying to accomplish, and troubleshoot issues by surfacing helpful suggestions and fixes.

This powerful tool utilizes computer vision and OpenAI's LLMS to analyze what's on your screen, making it capable of understanding error messages, logs, and stack traces from your IDE, terminal, or browser. By simply pressing ⌘-tab, Essential provides you with the necessary fixes in the appropriate context, eliminating the need for manual searching or copying and pasting error messages.

Essential also acts as a memory layer for your screen, allowing you to quickly reference and recall important moments from your recent work. It uses OCR technology to automatically categorize and store screenshots and information, helping you find the information you need in no time.

Privacy-conscious users can rest assured, as all data processing happens entirely on your Mac, ensuring your information never leaves your system. Download Essential now and take advantage of its powerful features to enhance your productivity and troubleshooting capabilities.",Visit Site,Productivity,"Effortlessly remember information on your Mac screen.
Understand and fix error messages with the help of AI.
Quickly reference and recall important moments.
Enhance productivity with an local AI assistant."
Background Changer,https://topai.tools/t/background-changer,"The AI Background Changer by Zmo.ai is an AI tool that allows you to easily replace the background image with a new, customized backdrop of your choice. Whether you want to create stunning photo-realistic product pictures for e-commerce or personalize the background of your images, this tool has got you covered.

With the AI Background Changer, you can generate backgrounds for product photography and upgrade e-commerce product images at a low cost. You can also use it to create lifestyle photos for your e-commerce products in just a few seconds. It is perfect for both small objects and changing the backgrounds of portraits and cars.

The AI Background Changer intelligently identifies the subject in the image and seamlessly replaces the background while maintaining the natural appearance of the subject. It can handle complex images with intricate details such as hair, fur, and transparent objects, delivering realistic and accurate results.

You can use the AI Background Changer for both personal and commercial purposes, including website design, marketing materials, and social media content. However, it is your responsibility to ensure that you have the necessary rights to use the images you upload.

Overall, the AI Background Changer by Zmo.ai is a powerful tool for effortlessly replacing backgrounds in images, making it a valuable asset for product photographers, e-commerce businesses, and anyone looking to enhance their images with customized backgrounds.",Freemium,Image Editing,"Generate backgrounds for product photography.
Create lifestyle photos for e-commerce products.
Replace backgrounds in portraits and cars.
Enhance images with customized backgrounds.
Upgrade e-commerce product images."
ZeroGPT Detector,https://topai.tools/t/zerogpt-detector,"ZeroGPT Detector is a widely trusted and widely used AI-powered plagiarism checker. It utilizes artificial intelligence to detect patterns and predict word choices, making it highly accurate in detecting AI-generated content. By analyzing billions of unique pages and words, ZeroGPT Detector can determine whether a piece of content is AI-generated or human-optimized. It can instantly differentiate between content that appears to be written by a human and content that seems to come from a robotic source like ChatGPT or GPT-4.

Using ZeroGPT Detector is easy. Simply input the text into the designated box and click the ""Detect Text"" button to initiate the detection process. The tool analyses the text using advanced algorithms developed by the ZeroGPT Detector team, supported by internal research and publications. It accurately determines the source of the text by employing fusion machine learning algorithms and natural language processing methodologies. It can effortlessly detect AI output text and provides fast and accurate results, eliminating the need for guesswork.

ZeroGPT Detector's AI content detector is useful for students, teachers, educators, writers, employees, freelancers, and copywriters. Its instant feedback and user-friendly interface make it effortless to use. Additionally, it supports multiple languages, making it accessible to a global user base.

In summary, ZeroGPT Detector provides a highly accurate and user-friendly solution for detecting AI-generated content. It is trusted by students, teachers, writers, and professionals around the world. With its advanced algorithms and extensive dataset, it helps users verify the authenticity of text and detect AI output almost instantly.",Free,AI Detection,"Verify the authenticity of text.
Detect AI-generated content.
Check for plagiarism in AI-generated text.
Ensure the originality of content.
Identify the source of AI-generated text."
Personal GPT,https://topai.tools/t/personal-gpt,"Personal GPT is an AI chatbot designed for privacy-conscious users. Unlike other chatbots, Personal GPT operates offline, ensuring that your data remains secure and confidential. With a one-time purchase, you can download and use the app on all your Apple devices, even sharing it with your family through Family Sharing.

The chatbot's AI-powered summarization feature allows you to save time and reduce complexity. It can swiftly analyze and summarize lengthy paragraphs, making it an invaluable tool for research and content creation. Additionally, Personal GPT can generate ideas and unlock your creative potential with its insightful suggestions, making it perfect for brainstorming and problem-solving.

One of the unique aspects of Personal GPT is its capability to enrich your learning experience. It delivers concise and relevant insights on a wide range of topics, helping you expand your knowledge with ease.

Say goodbye to costly subscription fees and embrace the lifetime value of Personal GPT. Its versatility, convenience, and creative potential make it a worthy investment for individuals who prioritize privacy. Please note that Personal GPT is an independently developed product and is not affiliated, endorsed, or sponsored by OpenAI.",Paid,Chat,"Keep your information private with a local chatbot running on your device.
Generate ideas and unlock creativity.
Expand knowledge on various topics easily without extra costs."
Incribo,https://topai.tools/t/incribo,"Introducing AuroraAI by Incribo, a powerful AI tool designed to improve the way you write and connect with readers. With AuroraAI, you can overcome common writing challenges and elevate your creativity, all in an easy-to-use interface.

This writers' tool offers a range of features to meet your diverse writing needs. Whether you struggle with writer's block, need a noise-free environment, or require confidence in your work, AuroraAI has got you covered. With its AI-centric system, AuroraAI delivers human-like outputs that are tailored to your input, saving you both time and money without compromising quality.

One of AuroraAI's standout features is its ability to support multiple genres, allowing you to confidently write across different styles and tones. Additionally, AuroraAI offers multi-language translation support, ensuring that your work reaches a global audience.

Incribo brings you an inclusive teams-based ecosystem, enabling the seamless collaboration of multiple users. As a writer, you can dive into the vibrant readers' community, growing and building a following from day one of your journey.",Visit Site,Writing,"Overcoming writer's block.
Creating a noise-free writing environment.
Generating human-like outputs.
Writing across different genres and styles.
Translating content into multiple languages."
Sidetrain,https://topai.tools/t/sidetrain-com,"Sidetrain's AI tutors offer personalized 1 on 1 sessions in AI. Gain hands-on experience and explore practical applications of AI. Elevate your skills with Sidetrain. Sidetrain currently provides and AI tutors section on the platform, find your 1 on 1 AI coach and start your journey or advance your knowledge in AI.",Usage based,Resources,"Find AI 1 on 1 coaches for different topics.
Learn how to use AI in your domain of work with AI coaches.
Get consultations from AI tutors and consultants."
Call Sign Generator,https://topai.tools/t/call-sign-generator,"Call Sign Generator is a powerful tool that enables you to create unique call signs tailored to your specific preferences. Whether you're a pilot, gamer, radio enthusiast, or involved in military operations, our generator will assist you in finding the perfect call sign that reflects your personality and style.

With Call Sign Generator, you can easily generate catchy and memorable call signs in a matter of seconds. Simply enter your first and last name (optional) into the designated fields and click the ""Generate Call Signs"" button. Even if you don't enter a name, the generator will still provide you with a selection of cool call sign ideas.",Free,Fun,"Generate personalized call signs.
Create unique call signs for that matches your personality.
Find catchy call sign ideas."
PixAI.ART,https://topai.tools/t/pixai-art,"Pixai is an AI art generator tool that can generate anime-style or realistic-style art for various use cases. It offers a character engine for generating original characters, and users can also generate chat bots for Discord or visual chat applications. The tool includes various ranking models to help users discover trending and popular artwork, with daily updates for the latest creations.

Pixai supports NSFW features and allows users to create artwork related to popular anime and games such as Fate, Genshin Impact, and Konosuba. PixAI's advanced AI art generator is equipped with advanced features such as controlnet, Hires fix, LoRAs and image to image that allows users to take the most control of their image results.

Browse the PixAI model market or use one of PixAI's default models or LoRAs to achieve your desired character or style. Share your AI art or the model you trained on PixAI's platform, and browse the huge AI art archive to find inspirations, prompts, and tutorials for your next AI art challenge.",Free,Art Generation,"Generate anime-style or realistic-style art.
Create original anime characters for your videos and stories.
Generate chat characters for Discord or visual chat applications."
PicTales,https://topai.tools/t/pictales,"Pictales is an AI-powered tool that allows you to generate unique stories based on your favorite images. With Pictales, you can upload your own images, select the genre and language, and watch the magic unfold as the AI engine creates a one-of-a-kind story every time. Supporting over 100 languages, Pictales can generate stories in any language you desire. It also offers multiple genres to choose from, including action, thriller, comedy, and many more. Whether you're a writer looking for inspiration or simply enjoy creative storytelling, Pictales is the perfect tool to help spark your imagination. Get started with Pictales today and let the AI engine bring your images to life with captivating and unique stories.",Freemium,Stories,"Generate unique stories based on uploaded images.
Spark creativity and inspiration for writers.
Create stories in multiple languages and genres."
GetIt.AI,https://topai.tools/t/open-gpt-plugin-store,"The Open Chat GPT Plugin Store is a directory that offers a wide range of AI plugins for chat applications. With hundreds of plugins to choose from, users can integrate these plugins into their chat applications to enhance functionality and improve user experience.

The store provides plugins for various categories such as productivity, analytics, communication, finance, gaming, marketing, programming, travel and more. Users can easily search for plugins based on their specific needs and select the ones that best fit their requirements.

The directory also offers a community-driven approach where users can contribute by registering their own plugins and integrating them into the chat application ecosystem. Additionally, there are resources and documentation available to help users build their own chat-GPT plugins.

Overall, the Open Chat GPT Plugin Store provides a comprehensive collection of AI plugins for chat applications, empowering users to enhance their chat experiences with advanced functionalities and automation.",Free,Aggregators,"Enhancing chat application functionality with different plugins.
Improving user experience in chatGPT.
Overcoming some of the limitations of chatGPT and adding functions.
Automating chatbot tasks."
Argil,https://topai.tools/t/argil,"Argil is a no-code AI automation tool that can save you hours of work every week. It allows you to build AI-powered workflows without the need for coding or complex data processing. With Argil, you can easily create workflows for text-to-text, image-to-image transformations, and much more.

One of the main features of Argil is its ability to transform text into automatic prompts, which can be used to generate new text or improve existing content. Additionally, the platform offers AI-powered templates for various use cases, such as generating chatbot responses, summarizing meeting notes, creating ad ideas, and even decorating empty rooms.

Argil's AI workflows can save you time and money by streamlining your work and automating repetitive tasks. The platform also allows you to personalize the results by customizing design assets and styles. Furthermore, you can integrate Argil with other tools and services through its robust API, enabling you to scale your processes and maximize productivity.",Free trial,No-code,"Automating tasks with different workflows.
Generating chatbot responses.
Summarizing meeting notes.
Creating Ad ideas.
Improve image quality."
My GPT Wizard,https://topai.tools/t/my-gpt-wizard,"My GPT Wizard is an AI writing and content generation partner that utilizes AI-driven creativity to meet all your content creation needs. From blogs and articles to websites and social media, it goes beyond just words to deliver better content.

My GPT Wizard allows to effortlessly create high-quality content in just three simple steps: select a template, fill the form, and get ready-to-publish results. Generate content in 25+ languages, create AI-driven images, and easily export in PDF & Word formats. Powered by GPT-4, My GPT Wizard ensures top-notch content for blogs, articles, websites, social media, and even more.",Free trial,Content creation,"Generate high quality blog posts easily and quickly.
Create website content on autopilot.
Write social media posts that engages users."
HubSpot Campaign Assistant,https://topai.tools/t/hubspot-campaign-assistant,"Hubspot Campaign Assistant, a free AI marketing asset creator from HubSpot. With Hubspot Campaign Assistant, you have the ability to generate copy for landing pages, emails, and ads with just a few clicks.

Instead of spending weeks on manual copywriting, let AI do the heavy lifting. Simply provide the key details of your campaign and select the preferred platform. The AI-powered Campaign Assistant will generate high-quality copy tailored to your brand's voice, featuring selling points and call-to-action.

With Campaign Assistant, you can save hours of time on copywriting, allowing you to focus on the details that require a personal touch. Whether it's landing pages, emails, or ad copy, this tool streamlines the creation of marketing assets and supercharges your campaigns. Best of all, Campaign Assistant is free to use. Start using Campaign Assistant today and experience the power of AI in your marketing efforts.",Free,Copywriting,"Generate copy for landing pages, emails, and ads.
Save time on copywriting and get inspiration.
Streamline marketing asset creation."
Kome,https://topai.tools/t/kome,"Kome is an all-in-one AI-powered bookmark extension that enhances your online browsing experience. With Kome, you can instantly summarize articles, webpages, news, and YouTube videos with a single click. It also serves as an efficient bookmark manager, allowing you to easily capture and store valuable content from websites.

One of Kome's standout features is the smart compose function, which utilizes your bookmarks to generate emails, tweets, and blog posts powered by AI. Additionally, it enables you to quickly find and copy email addresses in a matter of seconds.

Kome is not limited to summarizing and bookmarking alone. It also offers the ability to extract color palettes from websites and save them in your preferred format. Moreover, if you're tired of scrolling, Kome's lazy scroll feature can help you let the machine handle it for you. And if you're searching for a specific URL, Kome makes it easy by eliminating the need for tedious searches.

Adding Kome to your browser is a simple process. Just head to your browser's extension marketplace, search for ""Kome AI,"" and follow the installation instructions.",Freemium,Summarizer,"Enhancing online browsing experience with smart bookmarking.
Summarizing articles, videos and webpages with AI.
Boost productivity with efficient bookmark management."
HeyLibby,https://topai.tools/t/heylibby-ai,"HeyLibby.ai is an AI tool that helps you streamline your lead generation and lead management process including meeting scheduling and extracting information. With HeyLibby.ai, you can easily qualify leads, get the information you need from your customers, and book meetings directly to your calendar.

Customize and personalize HeyLibby.ai to match your brand's appearance and tone. Embed HeyLibby.ai on your website or share a personalized link to engage with potential customers.

HeyLibby.ai integrates with popular tools such as Google Sheets, Salesforce, and Honeybook, allowing you to seamlessly send leads to your preferred CRM system.

With easy-to-use search and sorting features, you can conveniently manage all your leads in one place. Add notes and keep track of important details to ensure you never miss an opportunity.

Take advantage of HeyLibby.ai's feedback system to continuously improve your lead generation strategy.",Free,Sales,"Qualify leads with the help of AI.
Gather customer information easily.
Book meetings with prospective leads.
Improve lead generation workflow by integrating with CRM systems."
